Symbol,Name,Last Sale,Net Change,% Change,Market Cap,Country,IPO Year,Volume,Sector,Industry
PEP,PepsiCo Inc. Common Stock,$133.38,-1.93,-1.426%,182930648392.00,United States,,11544686,Consumer Staples,Beverages (Production/Distribution)
PEPG,PepGen Inc. Common Stock,$1.53,-0.15,-8.929%,50019354.00,United States,2022,151508,Health Care,Biotechnology: Pharmaceutical Preparations
PESI,Perma-Fix Environmental Services Inc. Common Stock,$8.31,0.00,0.00%,153139946.00,United States,,104935,Industrials,Environmental Services
PET,Wag! Group Co. Common Stock,$0.13,-0.0225,-14.754%,6595397.00,United States,2021,6225177,Consumer Discretionary,Other Consumer Services
PETS,PetMed Express Inc. Common Stock,$3.50,-0.02,-0.568%,72297600.00,United States,,125555,Consumer Staples,Retail-Drug Stores and Proprietary Stores
PETWW,Wag! Group Co Warrant,$0.0134,0.0012,9.836%,679833.00,United States,2021,5272,Consumer Discretionary,Other Consumer Services
PFBC,Preferred Bank Common Stock,$80.13,-5.85,-6.804%,1150403172.00,United States,,296371,Finance,Major Banks
PFG,Principal Financial Group Inc Common Stock,$73.46,-1.54,-2.053%,16570469828.00,United States,2001,2703785,Finance,Accident &Health Insurance
PFIS,Peoples Financial Services Corp. Common Stock,$42.855,-0.895,-2.046%,428284428.00,United States,,17735,Finance,Major Banks
PFX,PhenixFIN Corporation Common Stock,$49.45,-1.6005,-3.135%,99878022.00,United States,,2452,Finance,Finance: Consumer Services
PFXNZ,PhenixFIN Corporation  5.25% Notes due 2028,$23.057,0.0837,0.364%,46570021.00,United States,,1015,Finance,Finance: Consumer Services
PGC,Peapack-Gladstone Financial Corporation Common Stock,$27.50,-0.16,-0.578%,483895363.00,United States,,58622,Finance,Commercial Banks
PGEN,Precigen Inc. Common Stock,$1.50,-0.09,-5.66%,441064460.00,United States,,1233504,Health Care,Biotechnology: Pharmaceutical Preparations
PGNY,Progyny Inc. Common Stock,$22.76,-0.14,-0.611%,1944006321.00,United States,2019,530308,Health Care,Misc Health and Biotechnology Services
PGY,Pagaya Technologies Ltd. Class A Ordinary Shares,$11.21,0.30,2.75%,844094369.00,United States,,1328242,Finance,Finance: Consumer Services
PGYWW,Pagaya Technologies Ltd. Warrants,$0.096,0.001,1.053%,7228640.00,United States,,4596,Finance,Finance: Consumer Services
PHAT,Phathom Pharmaceuticals Inc. Common Stock,$4.11,-0.01,-0.243%,286207947.00,United States,2019,875753,Health Care,Biotechnology: Pharmaceutical Preparations
PHIO,Phio Pharmaceuticals Corp. Common Stock,$2.04,-0.19,-8.52%,9747434.00,United States,,444978,Health Care,Biotechnology: Pharmaceutical Preparations
PHLT,Performant Healthcare Inc. Common Stock,$2.41,-0.11,-4.365%,188723822.00,United States,2012,84004,Consumer Discretionary,Other Consumer Services
PI,Impinj Inc. Common Stock,$91.51,1.76,1.961%,2651850263.00,United States,2016,815245,Technology,Industrial Machinery/Components
PIII,P3 Health Partners Inc. Class A Common Stock,$8.94,-0.56,-5.895%,64210039.00,United States,2021,7348,Health Care,Medical/Nursing Services
PIIIW,P3 Health Partners Inc. Warrant,$0.0142,-0.0007,-4.698%,101989.00,United States,2021,216443,Health Care,Medical/Nursing Services
PINC,Premier Inc. Class A Common Stock,$20.095,0.105,0.525%,1834822143.00,United States,2013,816070,Consumer Discretionary,Other Consumer Services
PKBK,Parke Bancorp Inc. Common Stock,$18.75,-0.315,-1.652%,222048675.00,United States,,14257,Finance,Major Banks
PKOH,Park-Ohio Holdings Corp. Common Stock,$19.30,-0.29,-1.48%,274658146.00,United States,,19656,Industrials,Industrial Specialties
PLAB,Photronics Inc. Common Stock,$18.67,-0.01,-0.054%,1186697107.00,United States,1987,358888,Technology,Semiconductors
PLAY,Dave & Buster's Entertainment Inc. Common Stock,$19.51,0.15,0.775%,673393444.00,United States,2014,899138,Consumer Discretionary,Restaurants
PLBC,Plumas Bancorp,$42.39,-0.57,-1.327%,250952318.00,United States,,7243,Finance,Finance Companies
PLBY,PLBY Group Inc. Common Stock,$0.98,-0.02,-2.00%,91872128.00,United States,2020,168492,Consumer Discretionary,Other Specialty Stores
PLCE,Children's Place Inc. (The) Common Stock,$5.37,-0.06,-1.105%,118338593.00,United States,1997,570129,Consumer Discretionary,Clothing/Shoe/Accessory Stores
PLL,Piedmont Lithium Inc. Common Stock,$8.47,-0.44,-4.938%,185861623.00,United States,,352695,Industrials,Mining & Quarrying of Nonmetallic Minerals (No Fuels)
PLMK,Plum Acquisition Corp. IV Class A Ordinary Shares,$10.10,0.005,0.05%,0.00,United States,2025,21430,,
PLMKU,Plum Acquisition Corp. IV Unit,$10.22,0.06,0.591%,0.00,United States,2025,13590,,
PLMR,Palomar Holdings Inc. Common stock,$147.48,-5.67,-3.702%,3934415693.00,United States,2019,389621,Finance,Property-Casualty Insurers
PLPC,Preformed Line Products Company Common Stock,$139.15,0.65,0.469%,687538898.00,United States,,16981,Industrials,Water Sewer Pipeline Comm & Power Line Construction
PLRX,Pliant Therapeutics Inc. Common Stock,$1.46,-0.11,-7.006%,89404985.00,United States,2020,653421,Health Care,Biotechnology: Pharmaceutical Preparations
PLSE,Pulse Biosciences Inc Common Stock (DE),$17.91,-1.36,-7.058%,1204873758.00,United States,2016,189695,Health Care,Medical/Dental Instruments
PLTR,Palantir Technologies Inc. Class A Common Stock,$112.78,5.00,4.639%,264509306747.00,United States,,103933839,Technology,Computer Software: Prepackaged Software
PLUG,Plug Power Inc. Common Stock,$0.8116,-0.037,-4.36%,750874536.00,United States,1999,62328930,Energy,Industrial Machinery/Components
PLUS,ePlus inc. Common Stock,$62.88,0.33,0.528%,1673640490.00,United States,1996,120068,Technology,Retail: Computer Software & Peripheral Equipment
PLXS,Plexus Corp. Common Stock,$126.80,1.45,1.157%,3428692034.00,United States,,142116,Technology,Electrical Products
PMCB,PharmaCyte  Biotech Inc. Common Stock,$1.22,0.01,0.826%,8373713.00,United States,,5043,Health Care,Biotechnology: Biological Products (No Diagnostic Substances)
PMTS,CPI Card Group Inc. Common Stock,$26.16,0.13,0.499%,294051663.00,United States,,13564,Consumer Discretionary,Publishing
PMVP,PMV Pharmaceuticals Inc. Common Stock,$1.04,-0.04,-3.704%,54010948.00,United States,2020,54559,Health Care,Biotechnology: Pharmaceutical Preparations
PNBK,Patriot National Bancorp Inc. Common Stock,$3.63,0.01,0.276%,267622810.00,United States,,121920,Finance,Major Banks
PNFP,Pinnacle Financial Partners Inc. Common Stock,$100.28,-0.07,-0.07%,7758335785.00,United States,,402949,Finance,Major Banks
PNFPP,Pinnacle Financial Partners Inc. Depositary shares of Pinnacle Financial Partners Inc. each representing a 1/40th Interest in a share of its 6.75% Fixed-Rate Non-Cumulative Perpetual Preferred Stock Series B,$24.40,-0.0101,-0.041%,1887748236.00,United States,,8930,Finance,Major Banks
PNRG,PrimeEnergy Resources Corporation Common Stock,$178.10,-1.31,-0.73%,297866907.00,United States,,14891,Energy,Oil & Gas Production
PNTG,The Pennant Group Inc. Common Stock ,$25.57,0.01,0.039%,880374819.00,United States,,86196,Health Care,Medical/Nursing Services
POAI,Predictive Oncology Inc. Common Stock,$1.06,-0.03,-2.752%,9467518.00,United States,,99330,Health Care,Industrial Specialties
POCI,Precision Optics Corporation Inc. Common stock,$4.29,0.04,0.941%,27305331.00,United States,,16602,Health Care,Biotechnology: Electromedical & Electrotherapeutic Apparatus
PODC,PodcastOne Inc. Common Stock,$1.78,-0.03,-1.657%,44315818.00,United States,,26034,Technology,Computer Software: Programming Data Processing
PODD,Insulet Corporation Common Stock,$260.71,1.33,0.513%,18308647574.00,United States,2007,465391,Health Care,Medical/Dental Instruments
POLA,Polar Power Inc. Common Stock,$2.06,-0.015,-0.723%,5173756.00,United States,2016,3649,Miscellaneous,Industrial Machinery/Components
POLE,Andretti Acquisition Corp. II Class A Ordinary Shares,$10.1903,-0.0097,-0.095%,0.00,United States,2024,26854,,
POLEU,Andretti Acquisition Corp. II Unit,$10.21,0.00,0.00%,0.00,United States,2024,62,,
POLEW,Andretti Acquisition Corp. II Warrant,$0.1998,-0.0001,-0.05%,0.00,United States,2024,452,,
POOL,Pool Corporation Common Stock,$291.59,2.89,1.001%,10972667289.00,United States,1995,824174,Consumer Discretionary,Industrial Specialties
POWI,Power Integrations Inc. Common Stock,$50.68,0.49,0.976%,2885364440.00,United States,1997,403880,Technology,Semiconductors
POWL,Powell Industries Inc. Common Stock,$186.60,2.26,1.226%,2251277312.00,United States,,220027,Energy,Electrical Products
POWW,AMMO Inc. Common Stock,$1.78,-0.08,-4.301%,211386985.00,United States,,724845,Industrials,Ordnance And Accessories
POWWP,AMMO Inc. 8.75% Series A Cumulative Redeemable Perpetual Preferred Stock,$22.1517,0.00,0.00%,2630663522.00,United States,,229,Industrials,Ordnance And Accessories
PPBI,Pacific Premier Bancorp Inc,$20.60,-0.64,-3.013%,1986618247.00,United States,,1401557,Finance,Major Banks
PPC,Pilgrim's Pride Corporation Common Stock,$53.55,-0.42,-0.778%,12697894078.00,United States,,636792,Consumer Staples,Meat/Poultry/Fish
PPIH,Perma-Pipe International Holdings Inc. Common Stock,$12.65,-0.44,-3.361%,100979485.00,United States,,11494,Industrials,Pollution Control Equipment
PPSI,Pioneer Power Solutions Inc. Common Stock,$2.75,-0.05,-1.786%,30580732.00,United States,,25811,Industrials,Electrical Products
PRAA,PRA Group Inc. Common Stock,$18.25,-0.11,-0.599%,721049470.00,United States,2002,181137,Finance,Finance: Consumer Services
PRAX,Praxis Precision Medicines Inc. Common Stock,$36.00,0.00,0.00%,725877000.00,United States,2020,300541,Health Care,Biotechnology: Pharmaceutical Preparations
PRCH,Porch Group Inc. Common Stock,$5.91,0.42,7.65%,709578128.00,United States,2020,2021325,Technology,Computer Software: Prepackaged Software
PRCT,PROCEPT BioRobotics Corporation Common Stock,$52.49,-0.07,-0.133%,2877433563.00,United States,2021,1973144,Health Care,Medical/Dental Instruments
PRDO,Perdoceo Education Corporation Common Stock,$24.92,0.15,0.606%,1642583733.00,United States,,436476,Real Estate,Other Consumer Services
PRGS,Progress Software Corporation Common Stock (DE),$59.11,0.04,0.068%,2543266564.00,United States,1991,598597,Technology,Computer Software: Prepackaged Software
PRLD,Prelude Therapeutics Incorporated Common Stock,$0.9009,0.0393,4.561%,49688810.00,United States,2020,109845,Health Care,Biotechnology: Pharmaceutical Preparations
PRME,Prime Medicine Inc. Common Stock,$1.69,-0.06,-3.429%,221661823.00,United States,2022,1031329,Health Care,Biotechnology: Biological Products (No Diagnostic Substances)
PROK,ProKidney Corp. Class A Ordinary Shares,$1.02,0.0298,3.009%,298551602.00,United States,2021,847590,Health Care,Biotechnology: Biological Products (No Diagnostic Substances)
PROP,Prairie Operating Co. Common Stock,$3.66,0.05,1.385%,98304200.00,United States,,427504,Finance,Finance: Consumer Services
PROV,Provident Financial Holdings Inc. Common Stock,$14.65,0.00,0.00%,98018916.00,United States,,155,Finance,Savings Institutions
PRPH,ProPhase Labs Inc. Common Stock (DE),$0.3689,0.0337,10.054%,15449169.00,United States,,258665,Health Care,Biotechnology: Pharmaceutical Preparations
PRPL,Purple Innovation Inc. Common Stock,$0.6301,-0.0345,-5.191%,67868370.00,United States,2015,255425,Consumer Discretionary,Home Furnishings
PRPO,Precipio Inc.  Common Stock,$6.03,-0.70,-10.401%,9071001.00,United States,,9217,Industrials,Biotechnology: Laboratory Analytical Instruments
PRSO,Peraso Inc. Common Stock,$0.917,0.017,1.889%,4441069.00,United States,,89638,Technology,Semiconductors
PRTA,Prothena Corporation plc Ordinary Shares,$9.70,0.05,0.518%,522121725.00,United States,,491670,Health Care,Biotechnology: Pharmaceutical Preparations
PRTC,PureTech Health plc American Depositary Shares,$17.26,0.12,0.70%,413241181.00,United States,,2828,Health Care,Biotechnology: Pharmaceutical Preparations
PRTH,Priority Technology Holdings Inc. Common Stock,$7.35,0.00,0.00%,584466370.00,United States,2016,220037,Consumer Discretionary,Business Services
PRTS,CarParts.com Inc. Common Stock,$0.9861,0.056,6.021%,57484759.00,United States,2007,918700,Consumer Discretionary,Auto & Home Supply Stores
PRVA,Privia Health Group Inc. Common Stock,$23.17,-0.29,-1.236%,2792290450.00,United States,2021,383161,Health Care,Medical/Nursing Services
PSEC,Prospect Capital Corporation Common Stock,$3.69,0.02,0.545%,1633728843.00,United States,2004,2095079,Finance,Finance: Consumer Services
PSIX,Power Solutions International Inc. Common Stock,$27.04,0.25,0.933%,622133454.00,United States,,202856,Industrials,Industrial Machinery/Components
PSMT,PriceSmart Inc. Common Stock,$99.98,-1.73,-1.701%,3074799417.00,United States,,294607,Consumer Discretionary,Department/Specialty Retail Stores
PSNL,Personalis Inc. Common Stock,$3.84,0.01,0.261%,338930953.00,United States,2019,366554,Health Care,Medical Specialities
PSTV,PLUS THERAPEUTICS Inc. Common Stock ,$0.7879,-0.0548,-6.503%,13394005.00,United States,,932444,Health Care,Medical/Dental Instruments
PTC,PTC Inc. Common Stock,$154.03,2.39,1.576%,18533435174.00,United States,,1016811,Technology,Computer Software: Prepackaged Software
PTCT,PTC Therapeutics Inc. Common Stock,$49.53,-0.02,-0.04%,3906399797.00,United States,2013,593753,Health Care,Biotechnology: Pharmaceutical Preparations
PTEN,Patterson-UTI Energy Inc. Common Stock,$6.09,-0.01,-0.164%,2353116909.00,United States,1993,13104193,Energy,Oil & Gas Production
PTGX,Protagonist Therapeutics Inc. Common Stock,$44.49,-0.36,-0.803%,2730987018.00,United States,2016,634255,Health Care,Biotechnology: Pharmaceutical Preparations
PTIX,Protagenic Therapeutics Inc. Common Stock,$0.218,0.0032,1.49%,1640598.00,United States,,174257,Health Care,Biotechnology: Pharmaceutical Preparations
PTLO,Portillo's Inc. Class A Common Stock,$10.73,0.11,1.036%,800485115.00,United States,2021,1846937,Consumer Discretionary,Restaurants
PTMN,Portman Ridge Finance Corporation Common Stock,$12.29,-0.02,-0.162%,113045571.00,United States,2006,61883,Finance,Finance: Consumer Services
PTON,Peloton Interactive Inc. Class A Common Stock,$6.29,0.01,0.159%,2452876680.00,United States,2019,9492984,Consumer Discretionary,Recreational Games/Products/Toys
PTPI,Petros Pharmaceuticals Inc. Common Stock,$0.054,0.0028,5.469%,2890028.00,United States,,2615815,Health Care,Biotechnology: Pharmaceutical Preparations
PUBM,PubMatic Inc. Class A Common Stock,$9.96,0.11,1.117%,483331838.00,United States,2020,502360,Technology,Computer Software: Programming Data Processing
PULM,Pulmatrix Inc. Common Stock,$6.71,-0.06,-0.886%,24506832.00,United States,2014,8398,Health Care,Biotechnology: Pharmaceutical Preparations
PVBC,Provident Bancorp Inc. (MD) Common Stock,$11.28,-0.32,-2.759%,200654765.00,United States,2015,17355,Finance,Banks
PVLA,Palvella Therapeutics Inc. Common Stock,$25.39,-0.08,-0.314%,279765986.00,United States,,65991,Health Care,Biotechnology: Pharmaceutical Preparations
PWOD,Penns Woods Bancorp Inc. Common Stock,$27.92,-0.01,-0.036%,212551554.00,United States,,5806,Finance,Major Banks
PWP,Perella Weinberg Partners Class A Common Stock,$16.89,0.06,0.357%,1465932959.00,United States,2020,850233,Finance,Finance: Consumer Services
PXLW,Pixelworks Inc.  Common Stock,$0.5682,-0.0128,-2.203%,34593425.00,United States,2000,217839,Technology,Semiconductors
PYPL,PayPal Holdings Inc. Common Stock,$65.34,0.57,0.88%,64637101814.00,United States,,8693362,Consumer Discretionary,Business Services
PYXS,Pyxis Oncology Inc. Common Stock,$1.06,-0.03,-2.752%,65285840.00,United States,2021,230253,Health Care,Biotechnology: Pharmaceutical Preparations
PZZA,Papa John's International Inc. Common Stock,$33.48,0.29,0.874%,1093491552.00,United States,1993,764573,Consumer Discretionary,Restaurants
QCOM,QUALCOMM Incorporated Common Stock,$148.56,1.35,0.917%,164307360000.00,United States,1991,5145633,Technology,Radio And Television Broadcasting And Communications Equipment
QCRH,QCR Holdings Inc. Common Stock,$64.16,-0.96,-1.474%,1084379003.00,United States,,98920,Finance,Major Banks
QDEL,QuidelOrtho Corporation Common Stock,$28.09,0.31,1.116%,1894573421.00,United States,,1191000,Health Care,Biotechnology: In Vitro & In Vivo Diagnostic Substances
QIPT,Quipt Home Medical Corp. Common Shares,$2.10,-0.04,-1.869%,90491673.00,United States,,57663,Health Care,Misc Health and Biotechnology Services
QLGN,Qualigen Therapeutics Inc. Common Stock,$3.475,-0.1643,-4.515%,2559098.00,United States,2015,29326,Health Care,Biotechnology: Pharmaceutical Preparations
QLYS,Qualys Inc. Common Stock,$126.75,1.86,1.489%,4623544926.00,United States,2012,219643,Technology,Computer Software: Prepackaged Software
QMCO,Quantum Corporation Common Stock,$11.84,0.46,4.042%,69076916.00,United States,,677027,Technology,Electronic Components
QNCX,Quince Therapeutics Inc. Common Stock,$1.23,0.105,9.333%,54122021.00,United States,2019,45730,Health Care,Biotechnology: Biological Products (No Diagnostic Substances)
QNST,QuinStreet Inc. Common Stock,$17.57,0.29,1.678%,992153302.00,United States,2010,244005,Consumer Discretionary,Business Services
QQQX,Nuveen NASDAQ 100 Dynamic Overwrite Fund Shares of Beneficial Interest,$23.59,0.23,0.985%,0.00,United States,,104362,Finance,Finance Companies
QRHC,Quest Resource Holding Corporation Common Stock,$2.24,-0.035,-1.538%,46158325.00,United States,,51734,Utilities,Environmental Services
QRVO,Qorvo Inc. Common Stock,$63.78,0.27,0.425%,5956849945.00,United States,,989192,Technology,Semiconductors
QSEAU,Quartzsea Acquisition Corporation Units,$10.12,0.07,0.697%,0.00,United States,2025,300,Finance,Blank Checks
QSI,Quantum-Si Incorporated Class A Common Stock,$1.23,0.01,0.82%,225261714.00,United States,2020,3244379,Industrials,Industrial Machinery/Components
QSIAW,Quantum-Si Incorporated Warrant,$0.33,-0.0215,-6.117%,60436070.00,United States,2020,6738,Industrials,Industrial Machinery/Components
QTRX,Quanterix Corporation Common Stock,$5.88,0.28,5.00%,228004103.00,United States,2017,618045,Industrials,Biotechnology: Laboratory Analytical Instruments
QTTB,Q32 Bio Inc. Common Stock,$1.87,0.02,1.081%,22809540.00,United States,2018,70794,Health Care,Biotechnology: Pharmaceutical Preparations
QUBT,Quantum Computing Inc. Common Stock,$7.13,0.19,2.738%,978553606.00,United States,,13210395,Technology,Computer Software: Prepackaged Software
QUIK,QuickLogic Corporation Common Stock,$5.34,0.41,8.316%,84366852.00,United States,1999,92865,Technology,Semiconductors
QVCGA,QVC Group Inc. Series A Common Stock,$0.1506,-0.0038,-2.461%,60026502.00,United States,,2608509,Consumer Discretionary,Catalog/Specialty Distribution
QVCGB,QVC Group Inc. Series B Common Stock,$5.87,0.46,8.503%,2339678383.00,United States,,3182,Consumer Discretionary,Catalog/Specialty Distribution
QVCGP,QVC Group Inc. 8.0% Fixed Rate Cumulative Redeemable Preferred Stock,$25.76,1.60,6.623%,10267481284.00,United States,,42238,Consumer Discretionary,Catalog/Specialty Distribution
RAIL,FreightCar America Inc. Common Stock,$6.34,-0.11,-1.705%,120842917.00,United States,2005,365774,Industrials,Railroads
RAIN,Rain Enhancement Technologies Holdco Inc. Class A Common Stock,$2.95,0.06,2.076%,22380213.00,United States,,82578,Technology,Industrial Machinery/Components
RAINW,Rain Enhancement Technologies Holdco Inc. Warrants,$0.143,0.023,19.167%,1084871.00,United States,,707,Technology,Industrial Machinery/Components
RAND,Rand Capital Corporation Common Stock,$19.03,-0.4021,-2.069%,56515560.00,United States,,3462,Finance,Finance: Consumer Services
RANG,Range Capital Acquisition Corp. Ordinary Shares,$10.10,0.03,0.298%,0.00,United States,2025,65727,,
RANGU,Range Capital Acquisition Corp. Units,$10.32,0.11,1.077%,0.00,United States,2024,510,,
RANI,Rani Therapeutics Holdings Inc. Class A Common Stock,$1.12,0.00,0.00%,64379480.00,United States,2021,580917,Health Care,Biotechnology: Pharmaceutical Preparations
RAPP,Rapport Therapeutics Inc. Common Stock,$10.62,-0.48,-4.324%,387592161.00,United States,2024,72054,Health Care,Biotechnology: Pharmaceutical Preparations
RAPT,RAPT Therapeutics Inc. Common Stock,$0.8786,0.0042,0.48%,115981199.00,United States,2019,767141,Health Care,Biotechnology: Pharmaceutical Preparations
RARE,Ultragenyx Pharmaceutical Inc. Common Stock,$38.09,0.45,1.196%,3523367889.00,United States,2014,575374,Health Care,Biotechnology: Pharmaceutical Preparations
RAVE,Rave Restaurant Group Inc. Common Stock,$2.50,0.086,3.563%,36778915.00,United States,,20620,Consumer Discretionary,Food Distributors
RBB,RBB Bancorp Common Stock,$15.82,-0.06,-0.378%,280490514.00,United States,2017,21941,Finance,Major Banks
RBBN,Ribbon Communications Inc. Common Stock,$3.61,0.03,0.838%,634363943.00,United States,,292317,Technology,EDP Services
RBCAA,Republic Bancorp Inc. Class A Common Stock,$67.01,-0.62,-0.917%,1306059946.00,United States,1998,28686,Finance,Major Banks
RBKB,Rhinebeck Bancorp Inc. Common Stock,$10.35,0.18,1.77%,114831470.00,United States,2019,3273,Finance,Banks
RCAT,Red Cat Holdings Inc. Common Stock,$5.19,-0.09,-1.705%,416034459.00,United States,,2514197,Technology,Computer Software: Prepackaged Software
RCEL,Avita Medical Inc. Common Stock,$10.07,0.18,1.82%,265420448.00,United States,,81753,Health Care,Medical/Dental Instruments
RCKT,Rocket Pharmaceuticals Inc. Common Stock,$7.23,-0.20,-2.692%,770932738.00,United States,2015,1634175,Health Care,Biotechnology: Pharmaceutical Preparations
RCKTW,Rocket Pharmaceuticals Inc. Warrant,$0.053,-0.019,-26.389%,5651374.00,United States,,31034,Health Care,Biotechnology: Pharmaceutical Preparations
RCKY,Rocky Brands Inc. Common Stock,$13.70,-0.09,-0.653%,102235592.00,United States,1993,53529,Consumer Discretionary,Shoe Manufacturing
RCMT,RCM Technologies Inc. Common Stock,$17.01,-0.43,-2.466%,129081695.00,United States,,18900,Consumer Discretionary,Professional Services
RDFN,Redfin Corporation Common Stock,$9.19,-0.06,-0.649%,1161517575.00,United States,2017,5071270,Finance,Real Estate
RDI,Reading International Inc Class A Common Stock,$1.28,0.01,0.787%,28523255.00,United States,,5125,Consumer Discretionary,Movies/Entertainment
RDIB,Reading International Inc Class B Common Stock,$11.20,1.06,10.454%,249578482.00,United States,,6758,Consumer Discretionary,Movies/Entertainment
RDNT,RadNet Inc. Common Stock,$50.26,-0.19,-0.377%,3721336596.00,United States,,581808,Health Care,Medical Specialities
RDUS,Radius Recycling Inc. Class A Common Stock,$29.24,0.05,0.171%,824625954.00,United States,,559427,Consumer Discretionary,Industrial Specialties
RDVT,Red Violet Inc. Common Stock ,$37.30,-0.26,-0.692%,519910638.00,United States,,42601,Technology,Computer Software: Prepackaged Software
RDZN,Roadzen Inc. Ordinary Shares,$0.911,0.028,3.171%,67587988.00,United States,2022,313206,Finance,Specialty Insurers
RDZNW,Roadzen Inc. Warrants,$0.0534,-0.0006,-1.111%,3961799.00,United States,2022,1400,Finance,Specialty Insurers
REAL,The RealReal Inc. Common Stock,$6.23,0.13,2.131%,693066368.00,United States,2019,1688761,Consumer Discretionary,Other Specialty Stores
REBN,Reborn Coffee Inc. Common Stock,$2.68,-0.03,-1.107%,12243601.00,United States,2022,72787,Consumer Discretionary,Restaurants
REFI,Chicago Atlantic Real Estate Finance Inc. Common Stock,$14.24,0.02,0.141%,297527498.00,United States,2021,89785,Real Estate,Real Estate Investment Trusts
REFR,Research Frontiers Incorporated Common Stock,$1.06,0.02,1.923%,35667114.00,United States,,30856,Miscellaneous,Multi-Sector Companies
REG,Regency Centers Corporation Common Stock,$71.42,-0.03,-0.042%,12953105227.00,United States,1993,1053569,Real Estate,Real Estate Investment Trusts
REGCO,Regency Centers Corporation 5.875% Series B Cumulative Redeemable Preferred Stock,$22.61,0.2389,1.068%,4100668009.00,United States,,2217,Real Estate,Real Estate Investment Trusts
REGCP,Regency Centers Corporation 6.25% Series A Cumulative Redeemable Preferred Stock,$23.25,-0.04,-0.172%,4216741760.00,United States,,2878,Real Estate,Real Estate Investment Trusts
REGN,Regeneron Pharmaceuticals Inc. Common Stock,$602.64,2.88,0.48%,65883426360.00,United States,1991,964394,Health Care,Biotechnology: Pharmaceutical Preparations
REKR,Rekor Systems Inc. Common Stock,$0.9751,0.0457,4.917%,108150495.00,United States,,6993268,Telecommunications,Telecommunications Equipment
RELI,Reliance Global Group Inc. Common Stock,$1.18,0.14,13.462%,3386445.00,United States,,469802,Finance,Specialty Insurers
RELL,Richardson Electronics Ltd. Common Stock,$8.84,-0.08,-0.897%,127075000.00,United States,1983,29811,Technology,Electronic Components
RELY,Remitly Global Inc. Common Stock,$20.05,0.07,0.35%,4022177969.00,United States,2021,1458172,Consumer Discretionary,Business Services
RENB,Renovaro Inc. Common Stock,$0.3732,0.0004,0.107%,59233374.00,United States,,525315,Health Care,Biotechnology: Pharmaceutical Preparations
RENE,Cartesian Growth Corporation II Class A Ordinary Shares,$11.91,0.00,0.00%,0.00,United States,2022,1357,Finance,Blank Checks
RENEW,Cartesian Growth Corporation II Warrant,$0.0991,0.00,0.00%,0.00,United States,2022,100,Finance,Blank Checks
RENT,Rent the Runway Inc. Class A Common Stock,$4.15,-0.15,-3.488%,16523204.00,United States,2021,33740,Consumer Discretionary,Other Specialty Stores
REPL,Replimune Group Inc. Common Stock,$9.05,-0.01,-0.11%,696983768.00,United States,2018,362638,Health Care,Biotechnology: Biological Products (No Diagnostic Substances)
REVB,Revelation Biosciences Inc. Common Stock,$2.92,-0.01,-0.341%,2643266.00,United States,2020,20421,Health Care,Biotechnology: Pharmaceutical Preparations
REVBW,Revelation Biosciences Inc. Warrant,$0.0108,-0.0042,-28.00%,9776.00,United States,2020,11416,Health Care,Biotechnology: Pharmaceutical Preparations
REYN,Reynolds Consumer Products Inc. Common Stock,$23.22,-0.23,-0.981%,4880174637.00,United States,2020,659398,Consumer Discretionary,Containers/Packaging
